gib	real	라벨러
예엌허늬 볉롧 앉 시해원요.	에어컨이 별로 안 시원해요.	용택
당묜과 츼즈가 부터의써 머끠 흼드러요.	당면과 치즈가 붙어있어 먹기 힘들어요.	용택
쌈썽뵤단 에플위 좋타.	삼성보단 애플이 좋다.	유빈
야위푠눈 념뮤 좋따.	아이폰은 너무 좋다.	유빈
활쟝쉬뤼 캐끝햐쥣는 안댜.	화장실이 깨끗하지는 않다.	유빈
주의늬 불칀절햬요.	주인이 불친절해요.	용택
표장동 념 콤콤햐게 헤줏섯선 께찐 컷업입 잚 왔얼오	포장도 넘 꼼꼼하게 해주셔서 깨진 것없이 잘 왔어요	종
팻숑 꺌꿈, 젝풂 포쟝됴 칼끎, 겉뷰떠 쇽꺄직 및움질깝닛닿.	배송 깔끔, 제품 포장도 깔끔, 겉부터 속까지 믿음직합니다.	종
샀쥔엣석 뽀읽눈 겻보댜 널였곶, 횻쓰뜸닒인 썸세항계 짤 쨍거줏셧써욕.	사진에서 보이는 것보다 넓었고, 호스트님이 섬세하게 잘 챙겨주셨어요.	종
슈처 포함잎랑꼬 핫셧눈데 숫까락위 엎네요... 줆뮨한씰 때 쭘의항셉욤.	수저 포함이라고 하셨는데 숟가락이 없네요... 주문하실 때 주의하세요.	종
넹쨩교웨써 요레뙨 엷름이 잇넬욥... 일렇궤 냉쟝코를 콴릿핫단뉘 샹땋힛 펼론눼오.	냉장고에서 오래된 얼음이 있네요... 이렇게 냉장고를 관리하다니 상당히 별로네요.	종
방엠섬 밤큄벌렘감 남왔습님담... 슥진도 더럽고 위생 상태가 불량합니다.. 놀랍습니다.	방에서 바퀴벌레가 나왔습니다... 수건도 더럽고 위생 상태가 불량합니다.. 놀랍습니다.	유라
군두만가 젅혋 바하삭지 않곫 밃릷 튀교 놓읁 거 줇싡 건즤 많읿 눜눜하녜요.	군만두가 전혀 바삭하지 않고 미리 튀겨 놓은 거 주신 건지 많이 눅눅하네요.	용택
핬 큷릷슯핇갋 뜨겁단 뜨싄 줉 앑았늕덻 맯웗섧 하싄 줉읁 몰랐녜요..	핫 크리스피가 뜨겁단 뜻인 줄 알았는데 매워서 핫인 줄은 몰랐네요..	용택
곫긻 잢낿갋 얾첳 싦핿욟. 잢낿 믽갊핝 동섕은 아예 잆돏 몼 댋넯욯	고기 잡내가 엄청 심해요. 잡내 민감한 동생은 아예 입도 못 대네용	용택
옯랝맍엛 머거떠늬 픠자됴 픸흘됴 긻댋 의하녜요.	오랜만에 먹었더니 피자도 피클도 기대 이하네요.	용택
넓묿 흼드러요 끈끈적끈적끈적적 흼드러요	너무 힘들어요 끈적끈적끈적끈적 힘들어요	용택
묜됴 닯 뿌러서 온댸다가 곲챃 븰흰냬 걔오즴	면도 다 뿔어서 온대다가 곱창 비린내 개오짐	용택
이 스파 진짜 좋아요!. 떠럽꼬 뿔친쫄하니깎 꺠찌뫄쎘욬 걔쏚 리븎강요해썼욦.	더럽고 불친절하니까 가지마세요 계속 리뷰강요했어요	
한쿸삼럄은 임햄함겠죠. 홤잠실이 넘무 작암욤 무좀건 숙솜깜짐 걸엄감얌햄요 함 20분	한국사람은 이해하겠죠. 화장실이 너무 작아요 무조건 숙소까지 걸어가야해요 한 20분	유라
한꾺인뜰 꼮 뽀쎼요. 이 찝 찐짜 떠러워요. 먼찌랑 머리카띾 찐짜찐짜많아써 청쏘삐 환뿔빧아낸 곳입니따. 무썬인터녰 짝똥안햬요 쭈의하쎼요. 따른 쫗은빵 찾아뽀쎼요. 여끼 찐짜 삐추천.	한국인들 꼭 보세요. 이 집 진짜 더러워요. 먼지랑 머리카락 진짜진짜많아서 청소비 환불받아낸 곳입니다. 무선인터넷 작동안해요 주의하세요. 다른 좋은방 찾아보세요. 여기 진짜 비추천.	유라
뱝맏 없쓿 떼 며쿰면 좋탉.	밥맛 없을 때 먹으면 좋다.	유빈
윙칫토 좋교 치권푼틂토 찐절학코 좋흖싯깐 뽄냇여오~	위치도 좋고 직원분들도 친절하고 좋은시간 보냈어요~	
갹격떼퓌 연눔겄 합낯 뺘쥔눈케 엽씁뉘따. 넝뮤 많쵸깼옆온 따움편눼돈 닫쉿 위옹섕갹 100푸로 윕뉘타.	가격대비 어느것 하나 빠지는게 없습니다. 너무 만족했어요 다음번에도 다시 이용생각 100프로 입니다.	
아플호 서울 갈 떄 요긜호 정차긥늬다.	앞으로 서울 갈 때 여기로 정착입니다.	
첿큷읹돏 1싧갅읿샇 긻닯릷곫 묿슩 줗굮읹줉앑았슶닓닯 첿곏돏없곫엏맣짅챃읿옓욟	체크인도 1시간이상 기다리고 무슨 중국인줄알았습니다 체계도없고엉망진창이예요	
스위틀훔 의하, 투숰 싀예는 가성븨 꽝! 서븨스 꽝! 읩늬다! 꽄 긔엌하셰요!!!!!!!	스위트룸 이하, 투숙 시에는 가성비 꽝! 서비스 꽝! 입니다! 꼭 기억하세요!!!!!!!	
맒솞릾핪낳핥났 없밯엚 쳕뷻 듦릾닣탋.	말소리하나하나 옆방에 전부 들립니다.	
전부다 마음에 들어요, 가격대비 부터 해서 모두 만족! 쑤엉쟝웨 앍잉틀잊 염청 만은커 빽꼰눈..	전부다 마음에 들어요, 가격대비 부터 해서 모두 만족! 수영장에 아이들이 엄청 많은거 빼고는..	
밯읆읿 넓묿 앉됇욟 5섷 홃텙 맍앏욟?	방음이 너무 안돼요 5성 호텔 맞아요?	
혹깡숱햐꼬 쉽은뒈 핏산혹텔깔톤운 엎써섦 ㅠㅠ 갸걱떼빗 녀뮤 많죡햇씁닢댜.	호캉스하고 싶은데 비싼호텔갈돈은 없어서 ㅠㅠ 가격대비 너무 만족했습니다.	
촄흐읜 조싘 댸긔 싧갅 한싀간 읿샇 걽렯욟 서븨스 쵧앆 호톄른 깨하끗고 조흔뎨..	체크인 조식 대기 시간 한시간 이상 걸려요 서비스 최악 호텔은 깨끗하고 좋은데..	
콕뀌 찹낵까 염청 쉼햄오. 찹내 뮌깖한 동셍은 앎옐 잎동 묫댄넸오 ㅠㅠ	고기 잡내가 엄청 심해요. 잡내 민감한 동생은 아예 입도 못대네요 ㅠㅠ	종
뷴명 국샨 팝윌략교 하눈 퉤 뱝밟 중칸 충갼엑 꺄늚곶 퀸 팡밝위 섞역있넹욤... 	분명 국산 밥이라고 하는 데 밥알 중간 중간에 가늘고 긴 밥알이 섞여있네요... 	종
문숱눌 많휨 탈랴교 했터닙 뮷순늘 똥쨀료 추씨눼욤 먹골 냠귈청똘론 만알셔 좋앗씁닛답.	무순을 많이 달라고 했더니 무순을 통째로 주시네요 먹고 남길정도로 많아서 좋았습니다.	종
쭘문한찌 툿심칸만엘 돛짝한네오. 젤료를 밧엣셔 칙첩 쟤뻬헤옴쒸납봐오.	주문한지 두시간만에 도착하네요. 재료를 밭에서 직접 재배해오시나봐요.	종
얾쩨는 분명 염청 뱌삯했는테 요늙은 얾청 눅뉵핥겝 왔여요 ㅠㅠ	어제는 분명 엄청 바삭했는데 오늘은 엄청 눅눅하게 왔어요 ㅠㅠ	종
촓밦엛 고추넁의 벎벆읉 핿줇싮닓닯. 머글 떄마다 괿롮넯욟	초밥에 고추냉이 범벅을 해주십니다. 먹을 때마다 괴롭네요	용택
박휘이따고훼서 곡종했는대 보쥔모태서용 거런데 위불들이 넘흐 둬럽.. 멀휘카락 붙어있고 얼룩이꼬 굴헤요 넘집집해서 긴팔긴바지 이버써여	바퀴 있다고해서 걱정했는데 보진 못했어요 그런데 이불들이 너무 더럽... 머리카락 붙어있고 얼룩 있고 그래요 넘 찝찝해서 긴팔 긴바지 입었어요	유라
솨즨에 소그지마세요데스 일단 방이 주낸 조바요데스네 냄새와 혼또니 스메리, 건물내므새므는 우리 자취방보다 더함곰팽이 꽃을 피귀 최적화되어있는 환경.	사진에 속지마세요. 일단 방이 정말 좁아요. 냄새가 정말 심하고 건물 냄새는 우리 자취방보다 더함. 곰팡이 꽃을 피기 최적화되어있는 환경.	유라